<?xml version="1.0" encoding="UTF-8"?>
<!DOCTYPE agenda SYSTEM "agenda.dtd">
<agenda>
	<persona sexo="mujer" profesion="funcionaria">
		<nombre>Ana</nombre>
		<apellido>Garcia</apellido>
        <movil compaÃ±ia="vodafone" tipo="prepago" >321323123</movil>
        <fijo>854539857</fijo>
	</persona>
	<persona profesion="personal de compaÃ±ia" sexo="varon">
		<nombre>Freddy</nombre>
		<apellido>Bernabue</apellido>
        <fijo>499348382</fijo>
	</persona>
	<persona>
		<nombre>Mark</nombre>
		<apellido>Ruiz</apellido>
		<jubilado/>
	</persona>
</agenda>
